"fr_BEL_derheu_int" "2017-08-01 08:31:34" "Jacqueline Galant, maman de Moïse" "<img src=""http://o1.ldh.be/image/thumb/59802e70cd70d65d251d0d4c.jpg"" width=""140"" height=""70"" alt="""" border=""0"" hspace=""4"" vspace=""4"" align=""left"" />La députée-bourgmestre de Jurbise a donné naissance à son premier enfant dimanche."
"fr_BEL_derheu_int" "2017-08-01 08:12:05" "Voici où nos ministres partent en vacances" "<img src=""http://o1.ldh.be/image/thumb/598029fccd70d65d251cf050.jpg"" width=""140"" height=""70"" alt="""" border=""0"" hspace=""4"" vspace=""4"" align=""left"" />À l’exception de quelques destinations exotiques, les ministres fédéraux partent ce mois d’août pour la France, la Grèce et l’Italie."
"fr_BEL_derheu_int" "2017-08-01 08:07:30" "Terrorisme: Londres maintient la pression sur les géants du web" "<img src=""http://o1.ldh.be/image/thumb/598028a0cd70d65d251cf03e.jpg"" width=""140"" height=""70"" alt="""" border=""0"" hspace=""4"" vspace=""4"" align=""left"" />La ministre britannique de l'Intérieur, Amber Rudd, effectue mardi une visite à San Francisco pour exhorter les grands groupes du web à lutter davantage contre les contenus extrémistes en ligne."
"fr_BEL_derheu_int" "2017-08-01 07:53:32" "L’Inami réclame 13.500.000 euros à 14 hôpitaux belges" "<img src=""http://o1.ldh.be/image/thumb/5980258bcd706e263f21ca8d.jpg"" width=""140"" height=""70"" alt="""" border=""0"" hspace=""4"" vspace=""4"" align=""left"" />Ces centres hospitaliers ont effectué des scans IRM avec des appareils non agréés."
"fr_BEL_derheu_int" "2017-08-01 07:51:06" "Chèques-repas et écochèques plus populaires que jamais" "<img src=""http://o1.ldh.be/image/thumb/598024cfcd706e263f21ca80.jpg"" width=""140"" height=""70"" alt="""" border=""0"" hspace=""4"" vspace=""4"" align=""left"" />Quelque 1,7 million de travailleurs belges ont reçu l'année passée une partie de leur salaire en chèques-repas, ressort-il d'une question parlementaire du député Georges Gilkinet (Ecolo) au ministre fédéral de l'Emploi Kris Peeters (CD&amp;V)."
"fr_BEL_derheu_int" "2017-08-01 06:42:44" "Le pet-sitting coûte en moyenne 11 euros au Belge" "<img src=""http://o2.ldh.be/image/thumb/598014dbcd706e263f21a6f4.jpg"" width=""140"" height=""70"" alt="""" border=""0"" hspace=""4"" vspace=""4"" align=""left"" />En 2017, le tarif journalier de garde d’animaux entre particuliers est estimé à 11,87 euros. Un prix qui varie selon les régions."
"fr_BEL_derheu_int" "2017-08-01 06:34:04" "Le gouvernement Michel renforce la lutte contre la fraude sociale" "<img src=""http://o1.ldh.be/image/thumb/598012c5cd70d65d251c9b1f.jpg"" width=""140"" height=""70"" alt="""" border=""0"" hspace=""4"" vspace=""4"" align=""left"" />Le gouvernement fédéral compte contrôler de plus près les gens bénéficiant d'avantages sociaux pour mieux lutter contre la fraude."
"fr_BEL_derheu_int" "2017-08-01 05:57:24" "Les certitudes absolues du prochain IPhone" "<img src=""http://o2.ldh.be/image/thumb/59800a6ccd706e263f2158c4.jpg"" width=""140"" height=""70"" alt="""" border=""0"" hspace=""4"" vspace=""4"" align=""left"" />L’écran bord à bord se confirme sur l’iPhone le plus audacieux jamais créé, qui se profile."
"fr_BEL_derheu_int" "2017-08-01 05:53:26" "Affaire russe: Trump aurait dicté la déclaration à son fils" "<img src=""http://o2.ldh.be/image/thumb/5980093bcd70d65d251c7f81.jpg"" width=""140"" height=""70"" alt="""" border=""0"" hspace=""4"" vspace=""4"" align=""left"" />Le président américain Donald Trump aurait dicté à son fils Donald Trump Jr. le récit qu'il a livré en juillet de sa rencontre avec une avocate russe en 2016, en pleine campagne électorale, a affirmé lundi le Washington Post."
"fr_BEL_derheu_int" "2017-08-01 05:48:04" "Un Belge sur la liste Interpol des attentats suicides" "<img src=""http://o1.ldh.be/image/thumb/59800840cd70d65d251c7f7b.jpg"" width=""140"" height=""70"" alt="""" border=""0"" hspace=""4"" vspace=""4"" align=""left"" />Le nom d’Abou Omar al-Belgiki figure dans une liste de kamikazes potentiels après la découverte d’une liste dans les ruines de Mossoul"
"fr_BEL_derheu_int" "2017-08-01 05:22:31" "Un traitement préventif contre le virus du sida testé avec succès en Belgique" "<img src=""http://o2.ldh.be/image/thumb/598001e6cd706e263f214124.jpg"" width=""140"" height=""70"" alt="""" border=""0"" hspace=""4"" vspace=""4"" align=""left"" />Un médicament-vaccin contre le virus du sida a été testé avec succès en Belgique, ce qui fait du pays un pionnier européen dans la lutte contre le VIH."
"fr_BEL_derheu_int" "2017-08-01 05:20:08" "Crise au Venezuela: Maduro se dit ""fier"" des sanctions de l'""Empereur Donald ..." "<img src=""http://o1.ldh.be/image/thumb/5980016ecd706e263f21411d.jpg"" width=""140"" height=""70"" alt="""" border=""0"" hspace=""4"" vspace=""4"" align=""left"" />Le président vénézuelien Nicolas Maduro, en pleine tourmente après les protestations massives de la population contre son projet de ré-écriture de la Constitution, a indiqué lundi être ""fier"" de faire l'objet de sanctions de la part des Etats-Unis."
"fr_BEL_derheu_int" "2017-08-01 05:18:04" "Plainte du Qatar à l'OMC contre le blocus imposé par ses voisins" "<img src=""http://o1.ldh.be/image/thumb/598000f4cd70d65d251c5f03.jpg"" width=""140"" height=""70"" alt="""" border=""0"" hspace=""4"" vspace=""4"" align=""left"" />Le Qatar a déposé plainte auprès de l'Organisation mondiale du Commerce (OMC) contre l'Arabie saoudite et ses alliés qui ont imposé un blocus au petit émirat gazier, a annoncé lundi soir le ministère qatari de l'Economie et du Commerce."
"fr_BEL_derheu_int" "2017-08-01 05:09:57" "Poids de l'industrie musicale belge: U2, stars du rock et du business" "<img src=""http://o1.ldh.be/image/thumb/597fff56cd706e263f214116.jpg"" width=""140"" height=""70"" alt="""" border=""0"" hspace=""4"" vspace=""4"" align=""left"" />La très lucrative tournée anniversaire des trente ans de l’album 
The Joshua Tree fait étape à Bruxelles ce mardi."
"fr_BEL_derheu_int" "2017-07-31 19:45:48" "Le directeur de la communication de la Maison Blanche, Anthony Scaramucci, limogé 10 jours ..." "<img src=""http://o1.ldh.be/image/thumb/597f7af6cd706e263f1f00bc.jpg"" width=""140"" height=""70"" alt="""" border=""0"" hspace=""4"" vspace=""4"" align=""left"" />Le sulfureux directeur de la communication de Donald Trump, Anthony Scaramucci, a quitté ses fonctions lundi, après seulement 10 jours à son poste, a indiqué un responsable de la Maison Blanche. M. Scaramucci, qui a défrayé la chronique la semaine ..."
"fr_BEL_derheu_int" "2017-07-31 18:49:53" "France: Wikileaks publie 71.000 emails de la campagne de Macron" "<img src=""http://o1.ldh.be/image/thumb/597f6d93cd706e263f1ee980.jpg"" width=""140"" height=""70"" alt="""" border=""0"" hspace=""4"" vspace=""4"" align=""left"" />Wikileaks a annoncé lundi avoir publié 71.000 courriels piratés juste avant le second tour de la présidentielle de responsables du parti du nouveau chef d'Etat français Emmanuel Macron, qui ""va en informer la justice""."
"fr_BEL_derheu_int" "2017-07-31 18:40:06" "L’erreur médicale qui a été fatale à John F. Kennedy" "<img src=""http://o1.ldh.be/image/thumb/597f6bd8cd706e263f1ee96a.jpg"" width=""140"" height=""70"" alt="""" border=""0"" hspace=""4"" vspace=""4"" align=""left"" />Ce n’est plus un secret, malgré l’image d’un président jeune et sportif que donnait la Maison Blanche à l’époque, John F. Kennedy était un homme en mauvaise santé, souffrant du dos au point qu’il devait souvent s’aider de béquilles pour marcher."
"fr_BEL_derheu_int" "2017-07-31 15:50:21" "Donald Trump: le ""chaos"" ne règne pas à la Maison Blanche" "<img src=""http://o3.ldh.be/image/thumb/597f4382cd70d65d2519c7f5.jpg"" width=""140"" height=""70"" alt="""" border=""0"" hspace=""4"" vspace=""4"" align=""left"" />Le président américain Donald Trump a nié lundi matin que le chaos régnait à la Maison Blanche, en dépit de l'apparition au grand jour de rivalités au sein de son administration et d'échecs répétés sur la réforme emblématique de la santé."
"fr_BEL_derheu_int" "2017-07-31 15:38:56" "La famille d'un jeune, qui accuse des policiers de Vilvorde de lui avoir cassé le bras, porte ..." "<img src=""http://o1.ldh.be/image/thumb/597f4103cd706e263f1e34f6.jpg"" width=""140"" height=""70"" alt="""" border=""0"" hspace=""4"" vspace=""4"" align=""left"" />La victime affirme avoir été brutalement traitée à la sortie du Mustaert Pub, un bar sur le territoire de Vilvorde, vendredi à 04h30. Il explique que les agents se sont montrés agressifs car il ne maîtrisait pas le néerlandais."
"fr_BEL_derheu_int" "2017-07-31 15:21:06" "Peines modérées pour les tortionnaires du petit Daryl, 6 ans" "<img src=""http://o2.ldh.be/image/thumb/597f3ccccd70d65d2519c7c1.jpg"" width=""140"" height=""70"" alt="""" border=""0"" hspace=""4"" vspace=""4"" align=""left"" />Le 26 décembre 2016, parce qu'il avait pris une crêpe sans autorisation dans la cuisine, le jeune Daryl avait été puni en étant enfermé sur le balcon de l'appartement de la rue de l'Alliance, à Saint-Josse-ten-Noode, durant quinze heures, vêtu d'un simple pyjama et de crocs."
"fr_BEL_derheu_int" "2017-07-31 15:09:16" "L'auteur de l'attaque dans un supermarché à Hambourg a agi par ""islamisme radical""" "<img src=""http://o1.ldh.be/image/thumb/597f3a50cd706e263f1e156c.jpg"" width=""140"" height=""70"" alt="""" border=""0"" hspace=""4"" vspace=""4"" align=""left"" />L'homme qui a poignardé à mort une personne dans un supermarché et fait six blessés à Hambourg, au nord de l'Allemagne, a agi par ""islamisme radical"", a indiqué lundi le parquet antiterroriste allemand."
"fr_BEL_derheu_int" "2017-07-31 14:36:20" "Une femme défigurée au couteau par un homme qui voulait l'embrasser de force" "<img src=""http://o3.ldh.be/image/thumb/597f33b4cd706e263f1e07a5.jpg"" width=""140"" height=""70"" alt="""" border=""0"" hspace=""4"" vspace=""4"" align=""left"" />Conduite à l'hôpital, elle a reçu vingt points de suture avant de déposer plainte."
"fr_BEL_derheu_int" "2017-07-31 14:28:34" "Thaïlande: quatre Belges blessés dans une collision entre deux bateaux" "<img src=""http://o1.ldh.be/image/thumb/597f3082cd70d65d25197dd9.jpg"" width=""140"" height=""70"" alt="""" border=""0"" hspace=""4"" vspace=""4"" align=""left"" />Le bateau transportant les Européens a chaviré, ses occupants se retrouvant dans l'eau en attendant les secours qui les ont finalement conduits à l'hôpital."
"fr_BEL_derheu_int" "2017-07-31 13:35:27" "Trafic ferroviaire fortement perturbé entre Namur et Liège dans les deux directions" "<img src=""http://o3.ldh.be/image/thumb/597f23f1cd70d65d251955a2.jpg"" width=""140"" height=""70"" alt="""" border=""0"" hspace=""4"" vspace=""4"" align=""left"" />La circulation ferroviaire a repris sur une voie, à vitesse réduite, sur la ligne 125 entre Namur et Liège, après avoir été interrompue lundi peu après 13h30 à la suite d'un accident de personne survenu à Engis (province de Liège), a indiqué ..."
"fr_BEL_derheu_int" "2017-07-31 11:40:04" "Les militaires bloqués au Congo ont été rapatriés" "<img src=""http://o1.ldh.be/image/thumb/597f0906cd706e263f1d5ede.jpg"" width=""140"" height=""70"" alt="""" border=""0"" hspace=""4"" vspace=""4"" align=""left"" />Les instructeurs militaires Belges bloqués au camp Kasuku à Kindu dans l’Est de la RDC sont revenus au plat pays. Ils sont rentrés à bord de plusieurs vols civils ces derniers jours. Le dernier C-130 qui rapporte du matériel est actuellement en chemin pour la Belgique."
"fr_BEL_derheu_int" "2017-07-31 10:57:09" "Pourquoi le nouveau gouvernement wallon inquiète les amoureux de la nature" "<img src=""http://o1.ldh.be/image/thumb/597effa9cd706e263f1d39f0.jpg"" width=""140"" height=""70"" alt="""" border=""0"" hspace=""4"" vspace=""4"" align=""left"" />Ils craignent de nouvelles mesures favorables aux chasseurs et nuisibles pour la nature. 
"
"fr_BEL_derheu_int" "2017-07-31 10:44:10" "Alexander D., l'individu qui a tué son ex de 17 ans et ses grands-parents, passe aux aveux" "<img src=""http://o2.ldh.be/image/thumb/597f1b5ccd70d65d25192844.jpg"" width=""140"" height=""70"" alt="""" border=""0"" hspace=""4"" vspace=""4"" align=""left"" />Alexander D., 25 ans, qui était suspecté d'être l'auteur du triple homicide à Moere et d'être impliqué dans la mort d'un homme à Mont-Saint-Amand, est passé aux aveux, indique lundi son avocate, Me Amélie Van Belleghem."
"fr_BEL_derheu_int" "2017-07-31 09:40:39" "Le périmètre de sécurité au palais de Justice de Bruxelles levé" "<img src=""http://o3.ldh.be/image/thumb/597eed86cd706e263f1ce1a2.jpg"" width=""140"" height=""70"" alt="""" border=""0"" hspace=""4"" vspace=""4"" align=""left"" />Le périmètre de sécurité autour du palais de justice de Bruxelles a été levé peu après 12h30. 
"
"fr_BEL_derheu_int" "2017-07-31 09:35:14" "Les prêtres belges en pleine déprime: voici les raisons" "<img src=""http://o1.ldh.be/image/thumb/597eebe8cd70d65d25188ed3.jpg"" width=""140"" height=""70"" alt="""" border=""0"" hspace=""4"" vspace=""4"" align=""left"" />L’absence de perspectives d’avenir est la première cause de déprime."
"fr_BEL_derheu_int" "2017-07-31 08:15:09" "Atteint d'une maladie rare, Sacha s'est envolé pour les Etats-Unis afin de se faire soigner" "<img src=""http://o1.ldh.be/image/thumb/597ed8bacd706e263f1c9960.jpg"" width=""140"" height=""70"" alt="""" border=""0"" hspace=""4"" vspace=""4"" align=""left"" />C'est à Philadelphie que le jeune Bruxellois et sa famille espèrent voir leur avenir s'éclaircir. Il y sera opéré le 2 août de lymphangiomatose, une maladie rare."
"fr_BEL_derheu_int" "2017-07-31 07:44:45" "Une violente altercation éclate entre un passager portant son bébé dans les bras et un ..." "<img src=""http://o3.ldh.be/image/thumb/597ed21ccd706e263f1c8df2.jpg"" width=""140"" height=""70"" alt="""" border=""0"" hspace=""4"" vspace=""4"" align=""left"" />Après 13h d'attente suite à un vol d'EasyJet (très) en retard, les esprits se sont échauffés à l'aéroport de Nice. Un homme portant un bébé dans les bras a ainsi interpellé un employé de l'aéroport pour tenter d'en savoir plus. Face au peu d'informations reçues, une altercation a fini par éclater entre les deux hommes."
"fr_BEL_derheu_int" "2017-07-31 07:14:27" "Daryl (6 ans), laissé 15 heures durant sur son balcon en plein hiver: le couple fixé sur son ..." "<img src=""http://o1.ldh.be/image/thumb/597ecabdcd706e263f1c8dbd.jpg"" width=""140"" height=""70"" alt="""" border=""0"" hspace=""4"" vspace=""4"" align=""left"" />Le tribunal correctionnel de Bruxelles prononce ce lundi matin son jugement concernant des parents qui avaient laissé leur garçon de 6 ans pendant 15 heures sur un balcon dans le froid, en décembre dernier."
"fr_BEL_derheu_int" "2017-07-31 06:40:59" "Visite royale pour les 100 ans de la bataille de Passchendaele (PHOTOS)" "<img src=""http://o1.ldh.be/image/thumb/597ec347cd70d65d2517c89d.jpg"" width=""140"" height=""70"" alt="""" border=""0"" hspace=""4"" vspace=""4"" align=""left"" />Le couple royal belge, le prince William et son épouse Kate ont assisté à la cérémonie du Last Post"
"fr_BEL_derheu_int" "2017-07-31 06:20:05" "Chien poignardé à Verviers: le second animal en danger" "<img src=""http://o1.ldh.be/image/thumb/597ebe9dcd70d65d251799bc.jpg"" width=""140"" height=""70"" alt="""" border=""0"" hspace=""4"" vspace=""4"" align=""left"" />Les propriétaires sont plus que sceptiques sur les chances de survie de Hope"
"fr_BEL_derheu_int" "2017-07-31 06:18:11" "Météo: de belles éclaircies et jusqu'à 26 degrés lundi après-midi" "<img src=""http://o3.ldh.be/image/thumb/597ebd6ccd70d65d251799b5.jpg"" width=""140"" height=""70"" alt="""" border=""0"" hspace=""4"" vspace=""4"" align=""left"" />De belles éclaircies rythmeront l'après-midi de lundi, avec des températures autour de 24 degrés dans le centre du pays et jusqu'à 26 degrés en Campine, selon les prévisions de l'IRM."
"fr_BEL_derheu_int" "2017-07-31 06:11:52" "Accident mortel d'une famille belge en Allemagne: ""Tamara a été projetée sur des ..." "<img src=""http://o1.ldh.be/image/thumb/597ebb05cd706e263f1c8c33.jpg"" width=""140"" height=""70"" alt="""" border=""0"" hspace=""4"" vspace=""4"" align=""left"" />Un Belge décède sur le coup, sa femme et son fils sont dans le coma. La sœur aînée de Kris, Patricia, témoigne."
"fr_BEL_derheu_int" "2017-07-31 06:08:45" "Australie: deux pères et leurs fils soupçonnés du ""complot terroriste"" déjoué à ..." "<img src=""http://o1.ldh.be/image/thumb/597ebb59cd706e263f1c8c3b.jpg"" width=""140"" height=""70"" alt="""" border=""0"" hspace=""4"" vspace=""4"" align=""left"" />Les quatre individus placés en détention à Sydney dans le cadre d'un ""complot terroriste"" déjoué en Australie, prévoyaient de faire exploser un avion à l'aide d'un explosif dissimulé dans un hachoir à viande, rapportent les médias nationaux lundi."
"fr_BEL_derheu_int" "2017-07-31 05:37:44" "Le paradoxe des attentats : le nombre de crimes a diminué!" "<img src=""http://o2.ldh.be/image/thumb/597eaf9fcd706e263f1c3727.jpg"" width=""140"" height=""70"" alt="""" border=""0"" hspace=""4"" vspace=""4"" align=""left"" />La section crime de la PJF n’a jamais traité si peu de dossiers à Bruxelles"
"fr_BEL_derheu_int" "2017-07-31 05:35:26" "Pour Trump et Abe, la Corée du Nord est une menace ""sérieuse""" "<img src=""http://o2.ldh.be/image/thumb/597eb37bcd70d65d25178484.jpg"" width=""140"" height=""70"" alt="""" border=""0"" hspace=""4"" vspace=""4"" align=""left"" />Les Etats-Unis et le Japon se sont inquiétés dimanche de la menace ""sérieuse et grandissante"" que représente la Corée du Nord, qui a tiré vendredi un missile intercontinental et affirme pouvoir atteindre désormais le territoire américain. 
"
"fr_BEL_derheu_int" "2017-07-30 21:43:00" "Violence extrême au Venezuela: le Parquet confirme 10 morts, les USA condamnent" "<img src=""http://o3.ldh.be/image/thumb/597ec406cd706e263f1c8cd2.jpg"" width=""140"" height=""70"" alt="""" border=""0"" hspace=""4"" vspace=""4"" align=""left"" />La violence meurtrière a fait irruption dimanche au Venezuela, le jour de l'élection de l'Assemblée constituante rejetée par les adversaires du président Nicolas Maduro."
"fr_BEL_derheu_int" "2017-07-30 19:09:54" "La Dernière Humeur: on a été bien cons avec le professeur Rollin, père de l'humour absurde" "<img src=""http://o1.ldh.be/image/thumb/597e21e1cd706e263f1a95fd.jpg"" width=""140"" height=""70"" alt="""" border=""0"" hspace=""4"" vspace=""4"" align=""left"" />La Dernière Humeur par Alexis Carantonis. Ah, c’est sûr qu’il n’ Instagramme pas autant que Kev Adams. Que son plan com est largement moins bichonné que celui de Gad Elmaleh. Pourtant, dans une imméritée discrétion, un immense nom de l’humour ..."
"fr_BEL_derheu_int" "2017-07-30 16:27:17" """J'ai un boa constricteur collé au visage!"": les pompiers décapitent un serpent ..." "<img src=""http://o1.ldh.be/image/thumb/597dfacacd70d65d25147d4e.jpg"" width=""140"" height=""70"" alt="""" border=""0"" hspace=""4"" vspace=""4"" align=""left"" />""J'ai un boa constricteur collé au visage!"" Voilà comment une quadragénaire de l'Ohio a présenté son cas aux pompiers de Sheffield Lake, qui ont dû décapiter l'animal pour décoller sa gueule de sa propriétaire."
"fr_BEL_derheu_int" "2017-07-30 14:37:13" "Une députée En Marche agressée sur un marché" "<img src=""http://o1.ldh.be/image/thumb/597de15ccd706e263f19c830.jpg"" width=""140"" height=""70"" alt="""" border=""0"" hspace=""4"" vspace=""4"" align=""left"" />La députée de la République en Marche des Hauts-de-Seine Laurianne Rossi a été agressée dimanche matin sur un marché à Bagneux en proche banlieue parisienne, a-t-on appris de sources concordantes."
"fr_BEL_derheu_int" "2017-07-30 13:23:29" "Un camp de guides évacué à Neufchâteau après des saccages répétés: ""Les scouts ..." "<img src=""http://o1.ldh.be/image/thumb/597dcfb3cd706e263f196a9f.jpg"" width=""140"" height=""70"" alt="""" border=""0"" hspace=""4"" vspace=""4"" align=""left"" />Après l’affaire - qui n’en était pas une - des chefs scouts irresponsables, une nouvelle histoire où, cette fois-ci, les scouts ont été victimes: un camp de guides installé près du village de Warmifontaine (Neufchâteau) a dû être évacué jeudi ..."
"fr_BEL_derheu_int" "2017-07-30 11:51:55" "Espagne: spectaculaire incendie sans victimes lors d'un festival de musique électronique" "<img src=""http://o2.ldh.be/image/thumb/597dba38cd70d65d2513cf74.jpg"" width=""140"" height=""70"" alt="""" border=""0"" hspace=""4"" vspace=""4"" align=""left"" />Plus de 22.000 personnes ont été évacuées en un temps record samedi soir après que la scène d'un festival de musique électronique, Unite Tomorrowland, près de Barcelone (nord-est de l'Espagne) a pris feu, sans faire de blessés, a-t-on appris auprès des secours."
"fr_BEL_derheu_int" "2017-07-30 11:24:05" "Un temps assez chaud avec un risque de faibles pluies" "<img src=""http://o2.ldh.be/image/thumb/597db3bbcd70d65d2513ba91.jpg"" width=""140"" height=""70"" alt="""" border=""0"" hspace=""4"" vspace=""4"" align=""left"" />Le temps deviendra assez chaud et le ciel nuageux dimanche après-midi, avec temporairement un peu de pluie ou une averse, selon les prévisions de l'IRM. Le mercure grimpera jusqu'à 20 degrés à la Côte et 25 degrés en Lorraine, sous un vent modéré à assez fort. Des rafales pourront atteindre 60 km/h."
"fr_BEL_derheu_int" "2017-07-30 11:13:39" "Castastrophe de Ghislenghien: 13 ans déjà!" "<img src=""http://o1.ldh.be/image/thumb/597db144cd706e263f18be6f.jpg"" width=""140"" height=""70"" alt="""" border=""0"" hspace=""4"" vspace=""4"" align=""left"" />Une centaine de personnes ont honoré ce matin la mémoire des victimes de cette tragédie industrielle."
"fr_BEL_derheu_int" "2017-07-30 11:02:45" "Ningxia, le cœur du vignoble chinois" "<img src=""http://o1.ldh.be/image/thumb/597daf35cd706e263f18b6ae.jpg"" width=""140"" height=""70"" alt="""" border=""0"" hspace=""4"" vspace=""4"" align=""left"" />Il faut s’attendre dans l’avenir à ce que nos enfants boivent du vin chinois."
"fr_BEL_derheu_int" "2017-07-30 09:04:39" "Quand votre chien est fugueur" "<img src=""http://o3.ldh.be/image/thumb/597d933dcd706e263f184845.jpg"" width=""140"" height=""70"" alt="""" border=""0"" hspace=""4"" vspace=""4"" align=""left"" />La cause la plus fréquente de la fugue chez le chien reste le trop-plein d’énergie… ou l’ennui"
"fr_BEL_derheu_int" "2017-07-30 08:09:50" "Allemagne: la fusillade dans une discothèque a fait deux morts et quatre blessés, indique la ..." "<img src=""http://o2.ldh.be/image/thumb/597d8637cd706e263f17f334.jpg"" width=""140"" height=""70"" alt="""" border=""0"" hspace=""4"" vspace=""4"" align=""left"" />Une fusillade survenue dans la nuit de samedi à dimanche à l'intérieur et aux abords d'une discothèque de la ville de Constance en Allemagne a fait deux morts et quatre blessés, a annoncé la police locale."
